name,value,type,parent,isOfficial1,End poverty in all its forms everywhere,Goal,,2,"End hunger, achieve food security and improved nutrition and promote sustainable agriculture",Goal,,3,Ensure healthy lives and promote well-being for all at all ages,Goal,,4,Ensure inclusive and equitable quality education and promote lifelong learning opportunities for all,Goal,,5,Achieve gender equality and empower all women and girls,Goal,,6,Ensure availability and sustainable management of water and sanitation for all,Goal,,7,"Ensure access to affordable, reliable, sustainable and modern energy for all",Goal,,8,"Promote sustained, inclusive and sustainable economic growth, full and productive employment and decent work for all",Goal,,9,"Build resilient infrastructure, promote inclusive and sustainable industrialization and foster innovation",Goal,,10,Reduce inequality within and among countries,Goal,,11,"Make cities and human settlements inclusive, safe, resilient and sustainable",Goal,,12,Ensure sustainable consumption and production patterns,Goal,,13,Take urgent action to combat climate change and its impacts[b],Goal,,14,"Conserve and sustainably use the oceans, seas and marine resources for sustainable development",Goal,,15,"Protect, restore and promote sustainable use of terrestrial ecosystems, sustainably manage forests, combat desertification, and halt and reverse land degradation and halt biodiversity loss",Goal,,16,"Promote peaceful and inclusive societies for sustainable development, provide access to justice for all and build effective, accountable and inclusive institutions at all levels",Goal,,17,Strengthen the means of implementation and revitalize the Global Partnership for Sustainable Development,Goal,,1.1,"By 2030, eradicate extreme poverty for all people everywhere, currently measured as people living on less than $1.25 a day",Target,1,1.2,"By 2030, reduce at least by half the proportion of men, women and children of all ages living in poverty in all its dimensions according to national definitions",Target,1,1.3,"Implement nationally appropriate social protection systems and measures for all, including floors, and by 2030 achieve substantial coverage of the poor and the vulnerable",Target,1,1.5,"By 2030, build the resilience of the poor and those in vulnerable situations and reduce their exposure and vulnerability to climate-related extreme events and other economic, social and environmental shocks and disasters",Target,1,2.1,"By 2030, end hunger and ensure access by all people, in particular the poor and people in vulnerable situations, including infants, to safe, nutritious and sufficient food all year round",Target,2,2.2,"By 2030, end all forms of malnutrition, including achieving, by 2025, the internationally agreed targets on stunting and wasting in children under 5 years of age, and address the nutritional needs of adolescent girls, pregnant and lactating women and older persons",Target,2,2.5,"By 2020, maintain the genetic diversity of seeds, cultivated plants and farmed and domesticated animals and their related wild species, including through soundly managed and diversified seed and plant banks at the national, regional and international levels, and promote access to and fair and equitable sharing of benefits arising from the utilization of genetic resources and associated traditional knowledge, as internationally agreed",Target,2,2.a,"Increase investment, including through enhanced international cooperation, in rural infrastructure, agricultural research and extension services, technology development and plant and livestock gene banks in order to enhance agricultural productive capacity in developing countries, in particular least developed countries",Target,2,2.b,"Correct and prevent trade restrictions and distortions in world agricultural markets, including through the parallel elimination of all forms of agricultural export subsidies and all export measures with equivalent effect, in accordance with the mandate of the Doha Development Round",Target,2,3.1,"By 2030, reduce the global maternal mortality ratio to less than 70 per 100,000 live births",Target,3,3.2,"By 2030, end preventable deaths of newborns and children under 5 years of age, with all countries aiming to reduce neonatal mortality to at least as low as 12 per 1,000 live births and under-5 mortality to at least as low as 25 per 1,000 live births",Target,3,3.3,"By 2030, end the epidemics of AIDS, tuberculosis, malaria and neglected tropical diseases and combat hepatitis, water-borne diseases and other communicable diseases",Target,3,3.4,"By 2030, reduce by one third premature mortality from non-communicable diseases through prevention and treatment and promote mental health and well-being",Target,3,3.5,"Strengthen the prevention and treatment of substance abuse, including narcotic drug abuse and harmful use of alcohol",Target,3,3.6,"By 2020, halve the number of global deaths and injuries from road traffic accidents",Target,3,3.7,"By 2030, ensure universal access to sexual and reproductive health-care services, including for family planning, information and education, and the integration of reproductive health into national strategies and programmes",Target,3,3.9,"By 2030, substantially reduce the number of deaths and illnesses from hazardous chemicals and air, water and soil pollution and contamination",Target,3,3.b,"Support the research and development of vaccines and medicines for the communicable and non-communicable diseases that primarily affect developing countries, provide access to affordable essential medicines and vaccines, in accordance with the Doha Declaration on the TRIPS Agreement and Public Health, which affirms the right of developing countries to use to the full the provisions in the Agreement on Trade-Related Aspects of Intellectual Property Rights regarding flexibilities to protect public health, and, in particular, provide access to medicines for all",Target,3,3.c,"Substantially increase health financing and the recruitment, development, training and retention of the health workforce in developing countries, especially in least developed countries and small island developing States",Target,3,3.d,"Strengthen the capacity of all countries, in particular developing countries, for early warning, risk reduction and management of national and global health risks",Target,3,4.1,"By 2030, ensure that all girls and boys complete free, equitable and quality primary and secondary education leading to relevant and effective learning outcomes",Target,4,4.2,"By 2030, ensure that all girls and boys have access to quality early childhood development, care and pre-primary education so that they are ready for primary education",Target,4,4.3,"By 2030, ensure equal access for all women and men to affordable and quality technical, vocational and tertiary education, including university",Target,4,4.4,"By 2030, substantially increase the number of youth and adults who have relevant skills, including technical and vocational skills, for employment, decent jobs and entrepreneurship",Target,4,4.5,"By 2030, eliminate gender disparities in education and ensure equal access to all levels of education and vocational training for the vulnerable, including persons with disabilities, indigenous peoples and children in vulnerable situations",Target,4,4.6,"By 2030, ensure that all youth and a substantial proportion of adults, both men and women, achieve literacy and numeracy",Target,4,4.a,"Build and upgrade education facilities that are child, disability and gender sensitive and provide safe, non-violent, inclusive and effective learning environments for all",Target,4,4.b,"By 2020, substantially expand globally the number of scholarships available to developing countries, in particular least developed countries, small island developing States and African countries, for enrolment in higher education, including vocational training and information and communications technology, technical, engineering and scientific programmes, in developed countries and other developing countries",Target,4,4.c,"By 2030, substantially increase the supply of qualified teachers, including through international cooperation for teacher training in developing countries, especially least developed countries and small island developing States",Target,4,5.3,"Eliminate all harmful practices, such as child, early and forced marriage and female genital mutilation",Target,5,5.4,"Recognize and value unpaid care and domestic work through the provision of public services, infrastructure and social protection policies and the promotion of shared responsibility within the household and the family as nationally appropriate",Target,5,5.5,"Ensure women's full and effective participation and equal opportunities for leadership at all levels of decision-making in political, economic and public life",Target,5,6.1,"By 2030, achieve universal and equitable access to safe and affordable drinking water for all",Target,6,6.2,"By 2030, achieve access to adequate and equitable sanitation and hygiene for all and end open defecation, paying special attention to the needs of women and girls and those in vulnerable situations",Target,6,6.4,"By 2030, substantially increase water-use efficiency across all sectors and ensure sustainable withdrawals and supply of freshwater to address water scarcity and substantially reduce the number of people suffering from water scarcity",Target,6,6.5,"By 2030, implement integrated water resources management at all levels, including through transboundary cooperation as appropriate",Target,6,6.a,"By 2030, expand international cooperation and capacity-building support to developing countries in water- and sanitation-related activities and programmes, including water harvesting, desalination, water efficiency, wastewater treatment, recycling and reuse technologies",Target,6,6.b,Support and strengthen the participation of local communities in improving water and sanitation management,Target,6,7.1,"By 2030, ensure universal access to affordable, reliable and modern energy services",Target,7,7.2,"By 2030, increase substantially the share of renewable energy in the global energy mix",Target,7,7.3,"By 2030, double the global rate of improvement in energy efficiency",Target,7,8.2,"Achieve higher levels of economic productivity through diversification, technological upgrading and innovation, including through a focus on high-value added and labour-intensive sectors",Target,8,8.4,"Improve progressively, through 2030, global resource efficiency in consumption and production and endeavour to decouple economic growth from environmental degradation, in accordance with the 10-Year Framework of Programmes on Sustainable Consumption and Production, with developed countries taking the lead",Target,8,8.5,"By 2030, achieve full and productive employment and decent work for all women and men, including for young people and persons with disabilities, and equal pay for work of equal value",Target,8,8.6,"By 2020, substantially reduce the proportion of youth not in employment, education or training",Target,8,8.7,"Take immediate and effective measures to eradicate forced labour, end modern slavery and human trafficking and secure the prohibition and elimination of the worst forms of child labour, including recruitment and use of child soldiers, and by 2025 end child labour in all its forms",Target,8,8.1,"Sustain per capita economic growth in accordance with national circumstances and, in particular, at least 7 per cent gross domestic product growth per annum in the least developed countries",Target,8,8.1,"Strengthen the capacity of domestic financial institutions to encourage and expand access to banking, insurance and financial services for all",Target,8,8.a,"Increase Aid for Trade support for developing countries, in particular least developed countries, including through the Enhanced Integrated Framework for Trade-related Technical Assistance to Least Developed Countries",Target,8,9.1,"Develop quality, reliable, sustainable and resilient infrastructure, including regional and trans-border infrastructure, to support economic development and human well-being, with a focus on affordable and equitable access for all",Target,9,9.2,"Promote inclusive and sustainable industrialization and, by 2030, significantly raise industry's share of employment and gross domestic product, in line with national circumstances, and double its share in least developed countries",Target,9,9.4,"By 2030, upgrade infrastructure and retrofit industries to make them sustainable, with increased resource-use efficiency and greater adoption of clean and environmentally sound technologies and industrial processes, with all countries taking action in accordance with their respective capabilities",Target,9,9.5,"Enhance scientific research, upgrade the technological capabilities of industrial sectors in all countries, in particular developing countries, including, by 2030, encouraging innovation and substantially increasing the number of research and development workers per 1 million people and public and private research and development spending",Target,9,9.a,"Facilitate sustainable and resilient infrastructure development in developing countries through enhanced financial, technological and technical support to African countries, least developed countries, landlocked developing countries and small island developing States",Target,9,9.b,"Support domestic technology development, research and innovation in developing countries, including by ensuring a conducive policy environment for, inter alia, industrial diversification and value addition to commodities",Target,9,9.c,Significantly increase access to information and communications technology and strive to provide universal and affordable access to the Internet in least developed countries by 2020,Target,9,10.1,"By 2030, progressively achieve and sustain income growth of the bottom 40 per cent of the population at a rate higher than the national average",Target,10,10.4,"Adopt policies, especially fiscal, wage and social protection policies, and progressively achieve greater equality",Target,10,10.6,"Ensure enhanced representation and voice for developing countries in decision-making in global international economic and financial institutions in order to deliver more effective, credible, accountable and legitimate institutions",Target,10,10.a,"Implement the principle of special and differential treatment for developing countries, in particular least developed countries, in accordance with World Trade Organization agreements",Target,10,10.b,"Encourage official development assistance and financial flows, including foreign direct investment, to States where the need is greatest, in particular least developed countries, African countries, small island developing States and landlocked developing countries, in accordance with their national plans and programmes",Target,10,10.c,"By 2030, reduce to less than 3 per cent the transaction costs of migrant remittances and eliminate remittance corridors with costs higher than 5 per cent",Target,10,11.1,"By 2030, ensure access for all to adequate, safe and affordable housing and basic services and upgrade slums",Target,11,11.5,"By 2030, significantly reduce the number of deaths and the number of people affected and substantially decrease the direct economic losses relative to global gross domestic product caused by disasters, including water-related disasters, with a focus on protecting the poor and people in vulnerable situations",Target,11,11.6,"By 2030, reduce the adverse per capita environmental impact of cities, including by paying special attention to air quality and municipal and other waste management",Target,11,11.b,"By 2020, substantially increase the number of cities and human settlements adopting and implementing integrated policies and plans towards inclusion, resource efficiency, mitigation and adaptation to climate change, resilience to disasters, and develop and implement, in line with the Sendai Framework for Disaster Risk Reduction 2015-2030, holistic disaster risk management at all levels",Target,11,12.2,"By 2030, achieve the sustainable management and efficient use of natural resources",Target,12,12.4,"By 2020, achieve the environmentally sound management of chemicals and all wastes throughout their life cycle, in accordance with agreed international frameworks, and significantly reduce their release to air, water and soil in order to minimize their adverse impacts on human health and the environment",Target,12,13.1,Strengthen resilience and adaptive capacity to climate-related hazards and natural disasters in all countries,Target,13,14.4,"By 2020, effectively regulate harvesting and end overfishing, illegal, unreported and unregulated fishing and destructive fishing practices and implement science-based management plans, in order to restore fish stocks in the shortest time feasible, at least to levels that can produce maximum sustainable yield as determined by their biological characteristics",Target,14,14.5,"By 2020, conserve at least 10 per cent of coastal and marine areas, consistent with national and international law and based on the best available scientific information",Target,14,15.1,"By 2020, ensure the conservation, restoration and sustainable use of terrestrial and inland freshwater ecosystems and their services, in particular forests, wetlands, mountains and drylands, in line with obligations under international agreements",Target,15,15.4,"By 2030, ensure the conservation of mountain ecosystems, including their biodiversity, in order to enhance their capacity to provide benefits that are essential for sustainable development",Target,15,15.5,"Take urgent and significant action to reduce the degradation of natural habitats, halt the loss of biodiversity and, by 2020, protect and prevent the extinction of threatened species",Target,15,15.a,Mobilize and significantly increase financial resources from all sources to conserve and sustainably use biodiversity and ecosystems,Target,15,15.b,"Mobilize significant resources from all sources and at all levels to finance sustainable forest management and provide adequate incentives to developing countries to advance such management, including for conservation and reforestation",Target,15,16.1,Significantly reduce all forms of violence and related death rates everywhere,Target,16,16.2,"End abuse, exploitation, trafficking and all forms of violence against and torture of children",Target,16,16.3,Promote the rule of law at the national and international levels and ensure equal access to justice for all,Target,16,16.5,Substantially reduce corruption and bribery in all their forms,Target,16,16.8,Broaden and strengthen the participation of developing countries in the institutions of global governance,Target,16,16.9,"By 2030, provide legal identity for all, including birth registration",Target,16,16.1,"Ensure public access to information and protect fundamental freedoms, in accordance with national legislation and international agreements",Target,16,16.a,"Strengthen relevant national institutions, including through international cooperation, for building capacity at all levels, in particular in developing countries, to prevent violence and combat terrorism and crime",Target,16,17.2,"Developed countries to implement fully their official development assistance commitments, including the commitment by many developed countries to achieve the target of 0.7 per cent of gross national income for official development assistance (ODA/GNI) to developing countries and 0.15 to 0.20 per cent of ODA/GNI to least developed countries; ODA providers are encouraged to consider setting a target to provide at least 0.20 per cent of ODA/GNI to least developed countries",Target,17,17.3,Mobilize additional financial resources for developing countries from multiple sources,Target,17,17.4,"Assist developing countries in attaining long-term debt sustainability through coordinated policies aimed at fostering debt financing, debt relief and debt restructuring, as appropriate, and address the external debt of highly indebted poor countries to reduce debt distress",Target,17,17.6,"Enhance North-South, South-South and triangular regional and international cooperation on and access to science, technology and innovation and enhance knowledge-sharing on mutually agreed terms, including through improved coordination among existing mechanisms, in particular at the United Nations level, and through a global technology facilitation mechanism",Target,17,17.8,"Fully operationalize the technology bank and science, technology and innovation capacity-building mechanism for least developed countries by 2017 and enhance the use of enabling technology, in particular information and communications technology",Target,17,17.9,"Enhance international support for implementing effective and targeted capacity-building in developing countries to support national plans to implement all the Sustainable Development Goals, including through North-South, South-South and triangular cooperation",Target,17,17.1,"Promote a universal, rules-based, open, non-discriminatory and equitable multilateral trading system under the World Trade Organization, including through the conclusion of negotiations under its Doha Development Agenda",Target,17,17.11,"Significantly increase the exports of developing countries, in particular with a view to doubling the least developed countries' share of global exports by 2020",Target,17,17.12,"Realize timely implementation of duty-free and quota-free market access on a lasting basis for all least developed countries, consistent with World Trade Organization decisions, including by ensuring that preferential rules of origin applicable to imports from least developed countries are transparent and simple, and contribute to facilitating market access",Target,17,17.18,"By 2020, enhance capacity-building support to developing countries, including for least developed countries and small island developing States, to increase significantly the availability of high-quality, timely and reliable data disaggregated by income, gender, age, race, ethnicity, migratory status, disability, geographic location and other characteristics relevant in national contexts",Target,17,17.19,"By 2030, build on existing initiatives to develop measurements of progress on sustainable development that complement gross domestic product, and support statistical capacity-building in developing countries",Target,17,1.1.1,"Proportion of population below the international poverty line, by sex, age, employment status and geographical location (urban/rural)",Indicator,1.1,1.2.1,"Proportion of population living below the national poverty line, by sex and age",Indicator,1.2,1.3.1,"Proportion of population covered by social protection floors/systems, by sex, distinguishing children, unemployed persons, older persons, persons with disabilities, pregnant women, newborns, work-injury victims and the poor and the vulnerable",Indicator,1.3,1.5.1,"Number of deaths, missing persons and persons affected by disaster per 100,000 people [a]",Indicator,1.5,1.5.2,Direct disaster economic loss in relation to global gross domestic product (GDP)[a],Indicator,1.5,1.5.3,Number of countries with national and local disaster risk reduction strategies[a],Indicator,1.5,2.1.1,Prevalence of undernourishment,Indicator,2.1,2.1.2,"Prevalence of moderate or severe food insecurity in the population, based on the Food Insecurity Experience Scale (FIES)",Indicator,2.1,2.2.1,Prevalence of stunting (height for age <-2 standard deviation from the median of the World Health Organization (WHO) Child Growth Standards) among children under 5 years of age,Indicator,2.2,2.2.2,"Prevalence of malnutrition (weight for height >+2 or <-2 standard deviation from the median of the WHO Child Growth Standards) among children under 5 years of age, by type (wasting and overweight)",Indicator,2.2,2.5.2,"Proportion of local breeds classified as being at risk, not-at-risk or at unknown level of risk of extinction",Indicator,2.5,2.a.1,The agriculture orientation index for government expenditures,Indicator,2.a,2.a.2,Total official flows (official development assistance plus other official flows) to the agriculture sector,Indicator,2.a,2.b.1,Producer Support Estimate,Indicator,2.b,2.b.2,Agricultural export subsidies,Indicator,2.b,3.1.1,Maternal mortality ratio,Indicator,3.1,3.1.2,Proportion of births attended by skilled health personnel,Indicator,3.1,3.2.1,Under-five mortality rate,Indicator,3.2,3.2.2,Neonatal mortality rate,Indicator,3.2,3.3.1,"Number of new HIV infections per 1,000 uninfected population, by sex, age and key populations",Indicator,3.3,3.3.2,"Tuberculosis incidence per 1,000 population",Indicator,3.3,3.3.3,"Malaria incidence per 1,000 population",Indicator,3.3,3.3.5,Number of people requiring interventions against neglected tropical diseases,Indicator,3.3,3.4.1,"Mortality rate attributed to cardiovascular disease, cancer, diabetes or chronic respiratory disease",Indicator,3.4,3.4.2,Suicide mortality rate,Indicator,3.4,3.5.2,"Harmful use of alcohol, defined according to the national context as alcohol per capita consumption (aged 15 years and older) within a calendar year in litres of pure alcohol",Indicator,3.5,3.6.1,Death rate due to road traffic injuries,Indicator,3.6,3.7.1,Proportion of women of reproductive age (aged 15-49 years) who have their need for family planning satisfied with modern methods,Indicator,3.7,3.7.2,"Adolescent birth rate (aged 10-14 years; aged 15-19 years) per 1,000 women in that age group",Indicator,3.7,3.9.1,Mortality rate attributed to household and ambient air pollution,Indicator,3.9,