name,value,type,parent,isOfficial3.9.2,"Mortality rate attributed to unsafe water, unsafe sanitation and lack of hygiene (exposure to unsafe Water, Sanitation and Hygiene for All (WASH) services)",Indicator,3.9,3.9.3,Mortality rate attributed to unintentional poisoning,Indicator,3.9,3.b.2,Total net official development assistance to the medical research and basic health sectors,Indicator,3.b,3.c.1,Health worker density and distribution,Indicator,3.c,3.d.1,International Health Regulations (IHR) capacity and health emergency preparedness,Indicator,3.d,4.1.1,"Proportion of children and young people: (a)Ô_inÔ_grades 2/3; (b) at the end of primary; and (c)Ô_atÔ_the end of lower secondary achieving at least a minimum proficiency level in (i) reading and (ii)Ô_mathematics, by sex)",Indicator,4.1,4.2.1,"Proportion of children under 5 years of age who are developmentally on track in health, learning and psychosocial well-being, by sex",Indicator,4.2,4.2.2,"Participation rate in organized learning (one year before the official primary entry age), by sex",Indicator,4.2,4.3.1,"Participation rate of youth and adults in formal and non-formal education and training in the previous 12 months, by sex",Indicator,4.3,4.4.1,"Proportion of youth and adults with information and communications technology (ICT) skills, by type of skill",Indicator,4.4,4.5.1,"Parity indices (female/male, rural/urban, bottom/top wealth quintile and others such as disability status, indigenous peoples and conflict-affected, as data become available) for all education indicators on this list that can be disaggregated",Indicator,4.5,4.6.1,"Percentage of population in a given age group achieving at least a fixed level of proficiency in functional (a) literacy and (b) numeracy skills, by sex",Indicator,4.6,4.a.1,Proportion of schools with access to: (a)Ô_electricity; (b) the Internet for pedagogical purposes; (c) computers for pedagogical purposes; (d)Ô_adapted infrastructure and materials for students with disabilities; (e) basic drinking water; (f) single-sex basic sanitation facilities; and (g) basic handwashing facilities (as per the WASH indicator definitions),Indicator,4.a,4.b.1,Volume of official development assistance flows for scholarships by sector and type of study,Indicator,4.b,4.c.1,Proportion of teachers in: (a) pre-primary; (b)Ô_primary; (c) lower secondary; and (d) upper secondary education who have received at least the minimum organized teacher training (e.g. pedagogical training) pre-service or in-service required for teaching at the relevant level in a given country,Indicator,4.c,5.3.1,Proportion of women aged 20-24 years who were married or in a union before age 15 and before age 18,Indicator,5.3,5.3.2,"Proportion of girls and women aged 15-49 years who have undergone female genital mutilation/cutting, by age",Indicator,5.3,5.4.1,"Proportion of time spent on unpaid domestic and care work, by sex, age and location",Indicator,5.4,5.5.1,Proportion of seats held by women in national parliaments and local governments,Indicator,5.5,5.5.2,Proportion of women in managerial positions,Indicator,5.5,6.1.1,Proportion of population using safely managed drinking water services,Indicator,6.1,6.2.1,"Proportion of population using safely managed sanitation services, including a hand-washing facility with soap and water",Indicator,6.2,6.4.2,Level of water stress: freshwater withdrawal as a proportion of available freshwater resources,Indicator,6.4,6.5.1,Degree of integrated water resources management implementation (0-100),Indicator,6.5,6.a.1,Amount of water- and sanitation-related official development assistance that is part of a government-coordinated spending plan,Indicator,6.a,6.b.1,Proportion of local administrative units with established and operational policies and procedures for participation of local communities in water and sanitation management,Indicator,6.b,7.1.1,Proportion of population with access to electricity,Indicator,7.1,7.1.2,Proportion of population with primary reliance on clean fuels and technology,Indicator,7.1,7.2.1,Renewable energy share in the total final energy consumption,Indicator,7.2,7.3.1,Energy intensity measured in terms of primary energy and GDP,Indicator,7.3,8.2.1,Annual growth rate of real GDP per employed person,Indicator,8.2,8.4.1,"Material footprint, material footprint per capita, and material footprint per GDP",Indicator,8.4,8.4.2,"Domestic material consumption, domestic material consumption per capita, and domestic material consumption per GDP",Indicator,8.4,8.5.2,"Unemployment rate, by sex, age and persons with disabilities",Indicator,8.5,8.6.1,"Proportion of youth (aged 15-24 years) not in education, employment or training",Indicator,8.6,8.7.1,"Proportion and number of children aged 5-17 years engaged in child labour, by sex and age",Indicator,8.7,8.1.1,Annual growth rate of real GDP per capita,Indicator,8.1,8.10.2,Proportion of adults (15 years and older) with an account at a bank or other financial institution or with a mobile-money-service provider,Indicator,8.1,8.a.1,Aid for Trade commitments and disbursements,Indicator,8.a,9.1.2,"Passenger and freight volumes, by mode of transport",Indicator,9.1,9.2.1,Manufacturing value added as a proportion of GDP and per capita,Indicator,9.2,9.2.2,Manufacturing employment as a proportion of total employment,Indicator,9.2,9.4.1,CO2 emission per unit of value added,Indicator,9.4,9.5.1,Research and development expenditure as a proportion of GDP,Indicator,9.5,9.5.2,Researchers (in full-time equivalent) per million inhabitants,Indicator,9.5,9.a.1,Total official international support (official development assistance plus other official flows) to infrastructure,Indicator,9.a,9.b.1,Proportion of medium and high-tech industry value added in total value added,Indicator,9.b,9.c.1,"Proportion of population covered by a mobile network, by technology",Indicator,9.c,10.1.1,Growth rates of household expenditure or income per capita among the bottom 40 per cent of the population and the total population,Indicator,10.1,10.4.1,"Labour share of GDP, comprising wages and social protection transfers",Indicator,10.4,10.6.1,Proportion of members and voting rights of developing countries in international organizations,Indicator,10.6,10.a.1,Proportion of tariff lines applied to imports from least developed countries and developing countries with zero-tariff,Indicator,10.a,10.b.1,"Total resource flows for development, by recipient and donor countries and type of flow (e.g., official development assistance, foreign direct investment and other flows)",Indicator,10.b,10.c.1,Remittance costs as a proportion of the amount remitted,Indicator,10.c,11.1.1,"Proportion of urban population living in slums, informal settlements or inadequate housing",Indicator,11.1,11.5.1,"Number of deaths, missing persons and persons affected by disaster per 100,000 people [a]",Indicator,11.5,11.5.2,"Direct disaster economic loss in relation to global GDP, including disaster damage to critical infrastructure and disruption of basic services [a]",Indicator,11.5,11.6.2,Annual mean levels of fine particulate matter (e.g. PM2.5 and PM10) in cities (population weighted),Indicator,11.6,11.b.2,Number of countries with national and local disaster risk reduction strategies [a],Indicator,11.b,12.2.1,"Material footprint, material footprint per capita, and material footprint per GDP",Indicator,12.2,12.2.2,"Domestic material consumption, domestic material consumption per capita, and domestic material consumption per GDP",Indicator,12.2,12.4.1,"Number of parties to international multilateral environmental agreements on hazardous waste, and other chemicals that meet their commitments and obligations in transmitting information as required by each relevant agreement",Indicator,12.4,13.1.2,"Number of deaths, missing persons and persons affected by disaster per 100,000 people [a]",Indicator,13.1,13.1.1,Number of countries with national and local disaster risk reduction strategies [a],Indicator,13.1,14.4.1,Proportion of fish stocks within biologically sustainable levels,Indicator,14.4,14.5.1,Coverage of protected areas in relation to marine areas,Indicator,14.5,15.1.1,Forest area as a proportion of total land area,Indicator,15.1,15.1.2,"Proportion of important sites for terrestrial and freshwater biodiversity that are covered by protected areas, by ecosystem type",Indicator,15.1,15.4.1,Coverage by protected areas of important sites for mountain biodiversity,Indicator,15.4,15.5.1,Red List Index,Indicator,15.5,15.a.1,Official development assistance and public expenditure on conservation and sustainable use of biodiversity and ecosystems,Indicator,15.a,15.b.1,Official development assistance and public expenditure on conservation and sustainable use of biodiversity and ecosystems,Indicator,15.b,16.1.1,"Number of victims of intentional homicide per 100,000 population, by sex and age",Indicator,16.1,16.2.1,Proportion of children aged 1-17 years who experienced any physical punishment and/or psychological aggression by caregivers in the past month,Indicator,16.2,16.2.3,Proportion of young women and men aged 18-29 years who experienced sexual violence by age 18,Indicator,16.2,16.3.2,Unsentenced detainees as a proportion of overall prison population,Indicator,16.3,16.5.2,"Proportion of businesses that had at least one contact with a public official and that paid a bribe to a public official, or were asked for a bribe by those public officials during the previous 12 months",Indicator,16.5,16.8.1,Proportion of members and voting rights of developing countries in international organizations,Indicator,16.8,16.9.1,"Proportion of children under 5 years of age whose births have been registered with a civil authority, by age",Indicator,16.9,16.10.1,"Number of verified cases of killing, kidnapping, enforced disappearance, arbitrary detention and torture of journalists, associated media personnel, trade unionists and human rights advocates in the previous 12 months",Indicator,16.1,16.a.1,Existence of independent national human rights institutions in compliance with the Paris Principles,Indicator,16.a,17.2.1,"Net official development assistance, total and to least developed countries, as a proportion of the Organization for Economic Cooperation and Development (OECD) Development Assistance Committee donors' gross national income (GNI)",Indicator,17.2,17.3.2,Volume of remittances (in United States dollars) as a proportion of total GDP,Indicator,17.3,17.4.1,Debt service as a proportion of exports of goods and services,Indicator,17.4,17.6.2,"Fixed Internet broadband subscriptions per 100 inhabitants, by speed",Indicator,17.6,17.8.1,Proportion of individuals using the Internet,Indicator,17.8,17.9.1,"Dollar value of financial and technical assistance (including through North-South, South-South and triangular cooperation) committed to developing countries",Indicator,17.9,17.10.1,Worldwide weighted tariff-average,Indicator,17.1,17.11.1,Developing countries' and least developed countries' share of global exports,Indicator,17.11,17.12.1,"Average tariffs faced by developing countries, least developed countries and small island developing States",Indicator,17.12,17.18.3,"Number of countries with a national statistical plan that is fully funded and under implementation, by source of funding",Indicator,17.18,17.19.1,Dollar value of all resources made available to strengthen statistical capacity in developing countries,Indicator,17.19,17.19.2,Proportion of countries that (a) have conducted at least one population and housing census in the last 10 years; and (b) have achieved 100 per cent birth registration and 80 per cent death registration,Indicator,17.19,SI_POV_DAY1,Proportion of population below the international poverty line of US$1.90 per day,Series,1.1.1,TRUESI_POV_EMP1,Proportion of employed population below the international poverty line of US$1.90 per day (the working poor),Series,1.1.1,TRUESI_POV_NAHC,Proportion of population below national poverty line,Series,1.2.1,TRUESI_COV_POPT,"Proportion of population covered by social assistance, social insurance and labour market programs",Series,1.3.1,TRUESI_COV_UEMP,Proportion of unemployed receiving unemployment benefits,Series,1.3.1,TRUESI_COV_LMKT,Proportion of the population covered by labour market programs,Series,1.3.1,TRUESI_COV_LMKTPQ,Proportion of the poorest quintile population covered by labour market programs,Series,1.3.1,TRUESI_COV_SOCINS,Proportion of the population covered by social insurance programs,Series,1.3.1,TRUESI_COV_SOCINSPQ,Proportion of the poorest quintile population covered by social insurance programs,Series,1.3.1,TRUESI_COV_SOCAST,Proportion of the population covered by social assistance programs,Series,1.3.1,TRUESI_COV_SOCASTPQ,Proportion of the poorest quintile population covered by social assistance programs,Series,1.3.1,TRUEVC_DSR_AFFCT,"Number of persons affected by disaster per 100,000 people",Series,1.5.1,FALSEVC_DSR_MORT,Number of deaths due to disaster,Series,1.5.1,FALSEVC_DSR_MISS,Missing persons due to disaster,Series,1.5.1,FALSEVC_DSR_GDPLS,Direct disaster economic loss in relation to global GDP,Series,1.5.2,FALSESG_DSR_NLRRS,National and local disaster risk reduction strategies,Series,1.5.3,FALSESN_ITK_DEFC,Prevalence of undernourishment,Series,2.1.1,TRUEAG_PRD_FIESMS,Estimated prevalence of moderate or severe food insecurity in the adult population,Series,2.1.2,TRUEAG_PRD_FIESMS_LB,Estimated prevalence of moderate or severe food insecurity in the population (lower bound),Series,2.1.2,TRUEAG_PRD_FIESMS_UB,Estimated prevalence of moderate or severe food insecurity in the population (upper bound),Series,2.1.2,TRUEAG_PRD_FIESS,Estimated prevalence of severe food insecurity in the population,Series,2.1.2,FALSEAG_PRD_FIESS_LB,Estimated prevalence of severe food insecurity in the population (lower bound),Series,2.1.2,FALSEAG_PRD_FIESS_UB,Estimated prevalence of severe food insecurity in the population (upper bound),Series,2.1.2,FALSESH_STA_STNT,Proportion of stunted children (height for age below minus two standard deviations from the median) under the age of 5 years,Series,2.2.1,TRUESH_STA_STNT_LB,Proportion of stunted children (height for age below minus two standard deviations from the median) under the age of 5 years (lower bound),Series,2.2.1,TRUESH_STA_STNT_UB,Proportion of stunted children (height for age below minus two standard deviations from the median) under the age of 5 years (upper bound),Series,2.2.1,TRUESH_STA_STNTN,Number of stunted children (height for age below minus two standard deviations from the median) under the age of 5 years,Series,2.2.1,FALSESH_STA_STNTN_LB,Number of stunted children (height for age below minus two standard deviations from the median) under the age of 5 years (lower bound),Series,2.2.1,FALSESH_STA_STNTN_UB,Number of stunted children (height for age below minus two standard deviations from the median) under the age of 5 years (upper bound),Series,2.2.1,FALSESH_STA_WAST,Proportion of wasted children (weight for height below minus two standard deviations from the median) under the age of 5 years,Series,2.2.2,TRUESH_STA_WAST_LB,Proportion of wasted children (weight for height below minus two standard deviations from the median) under the age of 5 years (lower bound),Series,2.2.2,TRUESH_STA_WAST_UB,Proportion of wasted children (weight for height below minus two standard deviations from the median) under the age of 5 years (upper bound),Series,2.2.2,TRUESH_STA_WASTN,Number of wasted children (weight for height below minus two standard deviations from the median) under the age of 5 years,Series,2.2.2,FALSESN_STA_OVWGT,Proportion of overweight children (weight for height above plus two standard deviations from the median) under the age of 5 years,Series,2.2.2,TRUESN_STA_OVWGT_LB,Proportion of overweight children (weight for height above plus two standard deviations from the median) under the age of 5 years (lower bound),Series,2.2.2,TRUESN_STA_OVWGT_UB,Proportion of overweight children (weight for height above plus two standard deviations from the median) under the age of 5 years (upper bound),Series,2.2.2,TRUESN_STA_OVWGTN,Number of overweight children (weight for height above plus two standard deviations from the median) under the age of 5 years,Series,2.2.2,FALSEER_RSK_LBRED,Proportion of local breeds classified as being not-at-risk of extinction,Series,2.5.2,TRUEER_NRK_LBRED,Proportion of local breeds classified as being at risk of extinction,Series,2.5.2,TRUEER_UNK_LBRED,Proportion of local breeds classified as being at unknown level of risk of extinction,Series,2.5.2,TRUEER_RSK_LBREDN,Number of local breeds classified as being not-at-risk of extinction,Series,2.5.2,FALSEER_NRK_LBREDN,Number of local breeds classified as being at risk of extinction,Series,2.5.2,FALSEER_UNK_LBREDN,Number of local breeds classified as being at unknown level of risk of extinction,Series,2.5.2,FALSEAG_PRD_ORTIND,The agriculture orientation index for government expenditures,Series,2.a.1,TRUEDC_TOF_AGRL,"Total official flows disbursements for agriculture, by recipient",Series,2.a.2,TRUEDC_TOF_AGRP,"Total official flows disbursements for agriculture, by recipient, as a percentage of donors' sector-allocable total official flows",Series,2.a.2,FALSEAG_PRD_PSEST,Producer Support Estimate,Series,2.b.1,TRUEAG_PRD_XSUBDY,Agricultural export subsidies,Series,2.b.2,TRUESH_STA_MORT,Maternal mortality ratio,Series,3.1.1,TRUESH_STA_BRTC,Proportion of births attended by skilled health personnel,Series,3.1.2,TRUESH_DYN_MORT,Under-five mortality rate,Series,3.2.1,TRUESH_DYN_MORTN,Number of under-five deaths,Series,3.2.1,FALSESH_DYN_IMRT,Infant mortality rate,Series,3.2.1,FALSESH_DYN_IMRTN,Number of infant deaths,Series,3.2.1,FALSESH_DYN_NMRT,Neonatal mortality rate,Series,3.2.2,TRUESH_DYN_NMRTN,Number of neonatal deaths,Series,3.2.2,FALSESH_HIV_INCD,Estimated HIV incidence rate,Series,3.3.1,TRUESH_TBS_INCD,"Tuberculosis incidence per 100,000 population",Series,3.3.2,TRUESH_TBS_INCD_LB,"Tuberculosis incidence per 100,000 population (lower bound)",Series,3.3.2,TRUESH_TBS_INCD_UB,"Tuberculosis incidence per 100,000 population (upper bound)",Series,3.3.2,TRUESH_TBS_MORT,"Tuberculosis deaths per 100,000 population",Series,3.3.2,FALSESH_TBS_MORT_LB,"Tuberculosis deaths per 100,000 population (lower bound)",Series,3.3.2,FALSESH_TBS_MORT_UB,"Tuberculosis deaths per 100,000 population (upper bound)",Series,3.3.2,FALSESH_STA_MALR,"Malaria incidence per 1,000 population",Series,3.3.3,TRUESH_TRP_INTVN,Number of people requiring interventions against neglected tropical diseases,Series,3.3.5,TRUESH_DTH_NCOM,"Mortality rate attributed to cardiovascular disease, cancer, diabetes or chronic respiratory disease",Series,3.4.1,TRUESH_DTH_CARDIO,Number of deaths attributed to cardiovascular disease,Series,3.4.1,FALSESH_DTH_CANCER,Number of deaths attributed to cancer,Series,3.4.1,FALSESH_DTH_DIABTS,Number of deaths attributed to diabetes,Series,3.4.1,FALSESH_DTH_CRESPD,Number of deaths attributed to chronic respiratory disease,Series,3.4.1,FALSESH_STA_SCIDE,Suicide mortality rate,Series,3.4.2,TRUESH_STA_SCIDEN,Number of deaths attributed to suicide,Series,3.4.2,FALSESH_ALC_CONSPT,Alcohol per capita consumption (aged 15 years and older) within a calendar year in litres of pure alcohol,Series,3.5.2,TRUESH_STA_TRAF,Death rate due to road traffic injuries,Series,3.6.1,TRUESH_FPL_MTMM,Proportion of women married or in a union of reproductive age (aged 15-49 years) who have their need for family planning satisfied with modern methods,Series,3.7.1,FALSESP_DYN_ADKL,"Adolescent birth rate per 1,000 adolescent women aged 15-19",Series,3.7.2,TRUESH_STA_AIRP,Mortality rate attributed to household and ambient air pollution,Series,3.9.1,TRUESH_STA_WASH,"Mortality rate attributed to unsafe water, unsafe sanitation and lack of hygiene",Series,3.9.2,TRUESH_STA_POISN,Mortality rate attributed to unintentional poisonings,Series,3.9.3,TRUEDC_TOF_HLTHL,"Total official flows for medical research and basic heath sectors, by recipient",Series,3.b.2,TRUEDC_TOF_HLTHP,"Total official flows for medical research and basic heath sectors, by recipient, as a percentage of donors' sector-allocable total official flows",Series,3.b.2,FALSESH_MED_HWKR,Health worker density and distribution,Series,3.c.1,FALSESH_IHR_CAPPRD,International Health Regulations (IHR) core capacity index,Series,3.d.1,TRUESE_PRM_RDNG,Proportion of children at the end of primary achieving at least a minimum proficiency level in reading,Series,4.1.1,TRUESE_PRM_MATH,Proportion of children at the end of primary achieving at least a minimum proficiency level in mathematics,Series,4.1.1,TRUESE_LSC_RDNG,Proportion of children at‘_the end of lower secondary achieving at least a minimum proficiency level in reading,Series,4.1.1,TRUESE_LSC_MATH,Proportion of children at‘_the end of lower secondary achieving at least a minimum proficiency level in mathematics,Series,4.1.1,TRUESE_G23_RDG,Proportion of children in‘_grades 2/3 achieving at least a minimum proficiency level in reading,Series,4.1.1,TRUESE_G23_MATH,Proportion of children‘_in‘_grades 2/3 achieving at least a minimum proficiency level in mathematics,Series,4.1.1,TRUESE_DEV_ONTRK,"Percentage of children aged 36-59 months who are developmentally on track in at least three of the following domains: literacy-numeracy, physical development, social-emotional development and learning",Series,4.2.1,FALSESE_PRE_PARTN,Participation rate in organized learning (one year before the official primary entry age),Series,4.2.2,TRUESE_ADT_EDUCTRN,Participation rate of youth and adults in formal and non-formal education and training in the previous 12 months,Series,4.3.1,TRUESE_ADT_ICTCPY,"Proportion of youth and adults with information and communications technology (ICT) skill, copying or moving a file or folder",Series,4.4.1,FALSESE_ADT_ICTINSTL,"Proportion of youth and adults with information and communications technology (ICT) skill, using basic arithmetic formula in a spreadsheet",Series,4.4.1,FALSESE_ADT_ICTCTDV,"Proportion of youth and adults with information and communications technology (ICT) skill, connecting and installing new devices",Series,4.4.1,FALSESE_PRE_GPITCH,Gender parity index of teachers in pre-primary education who are trained,Series,4.5.1,TRUESE_PRM_GPITCH,Gender parity index of teachers in primary education who are trained,Series,4.5.1,TRUESE_LSC_GPITCH,Gender parity index of teachers in lower secondary education who are trained,Series,4.5.1,TRUESE_USC_GPITCH,Gender parity index of teachers in upper secondary education who are trained,Series,4.5.1,TRUESE_SEC_GPITCH,Gender parity index of teachers in secondary education who are trained,Series,4.5.1,TRUESE_PRM_GPIRDNG,Gender parity index for achievement in reading by the end of primary,Series,4.5.1,TRUESE_PRM_GPIMATH,Gender parity index for achievement in mathematics by the end of primary,Series,4.5.1,TRUESE_LSC_GPIRDNG,Gender parity index for achievement in reading by the end of lower secondary,Series,4.5.1,TRUESE_LSC_GPIMATH,Gender parity index for achievement in mathematics by the end of lower secondary,Series,4.5.1,TRUESE_G23_GPIRDG,Gender parity index for achievement in reading in grades 2/3,Series,4.5.1,TRUESE_G23_GPIMATH,Gender parity index for achievement in mathematics in grades 2/3,Series,4.5.1,TRUESE_PRE_GPIPARTN,Gender parity index for participation rate in organized learning (one year before the official primary entry age),Series,4.5.1,TRUESE_ADT_NMRCY,Percentage of population in a given age group achieving at least a fixed level of proficiency in functional numeracy skills,Series,4.6.1,TRUESE_ADT_LTRCY,Percentage of population in a given age group achieving at least a fixed level of proficiency in functional literacy skills,Series,4.6.1,TRUESE_SCH_H2O,Proportion of schools with access to basic drinking water,Series,4.a.1,TRUESE_PRM_H2O,"Proportion of schools with access to basic drinking water, primary level",Series,4.a.1,TRUESE_LSC_H2O,"Proportion of schools with access to basic drinking water, lower secondary level",Series,4.a.1,TRUESE_SCH_ELECT,Proportion of schools with access to electricity,Series,4.a.1,TRUESE_PRM_ELECT,"Proportion of schools with access to electricity, primary level",Series,4.a.1,TRUESE_PLS_ELECT,"Proportion of schools with access to electricity, primary and lower secondary level",Series,4.a.1,TRUESE_PRS_ELECT,"Proportion of schools with access to electricity, primary and secondary level",Series,4.a.1,TRUESE_LSC_ELECT,"Proportion of schools with access to electricity, lower secondary level",Series,4.a.1,TRUESE_USC_ELECT,"Proportion of schools with access to electricity, upper secondary level",Series,4.a.1,TRUESE_SEC_ELECT,"Proportion of schools with access to electricity, secondary combined level",Series,4.a.1,TRUESE_PRM_INTNT,"Proportion of schools with access to the internet for pedagogical purposes, primary level",Series,4.a.1,TRUESE_PRS_INTNT,"Proportion of schools with access to the internet for pedagogical purposes, primary and secondary level",Series,4.a.1,TRUESE_LSC_INTNT,"Proportion of schools with access to the internet for pedagogical purposes, lower secondary level",Series,4.a.1,TRUESE_USC_INTNT,"Proportion of schools with access to the internet for pedagogical purposes, upper secondary level",Series,4.a.1,TRUESE_SEC_INTNT,"Proportion of schools with access to the internet for pedagogical purposes, secondary combined level",Series,4.a.1,TRUESE_PRM_CMPTR,"Proportion of schools with access to computers for pedagogical purposes, primary level",Series,4.a.1,TRUE